abstract_id	title	abstract
24442316	Cultured mycelium Cordyceps sinensis protects liver sinusoidal endothelial cells in acute liver injured mice.	Cultured mycelium Cordyceps sinensis (CMCS) was widely used for a variety of diseases including liver injury, the current study aims to investigate the protective effects of CMCS on liver sinusoidal endothelial cells (LSECs) in acute injury liver and related action mechanisms. The mice were injected intraperitoneally with lipopolysaccharide (LPS) and D-galactosamine (D-GalN). 39 male BABL/c mice were randomly divided into four groups: normal control, model control, CMCS treatment and 1,10-phenanthroline treatment groups. The Serum liver function parameters including alanine aminotransferase (ALT) and aspartate aminotransferase (AST) levels were assayed with the commercial kit. The inflammation and scaffold structure in liver were stained with hematoxylin and eosin and silver staining respectively. The LSECs and sub-endothelial basement membrane were observed with the scanning and transmission electronic microscope. The protein expressions of intercellular adhesion molecule-1 (ICAM-1) and vascular cell adhesion molecule-1 (VCAM-1) in liver were analyzed with Western blotting. Expression of von Willebrand factor (vWF) was investigated with immunofluorescence staining. The lipid peroxidation indicators including antisuperoxideanion (ASAFR), hydroxyl free radical (.OH), superoxide dismutase (SOD), malondialdehyde and glutathione S-transferase (GST) were determined with kits, and matrix metalloproteinase-2 and 9 (MMP-2/9) activities in liver were analyzed with gelatin zymography and in situ fluorescent zymography respectively. The model mice had much higher serum levels of ALT and AST than the normal mice. Compared to that in the normal control, more severe liver inflammation and hepatocyte apoptosis, worse hepatic lipid peroxidation demonstrated by the increased ASAFR, .OH and MDA, but decreased SOD and GST, increased MMP-2/9 activities and VCAM-1, ICAM-1 and vWF expressions, which revealed obvious LSEC injury and scaffold structure broken, were shown in the model control. Compared with the model group, CMCS and 1,10-phenanthroline significantly improved serum ALT/AST, attenuated hepatic inflammation and improved peroxidative injury in liver, decreased MMP-2/9 activities in liver tissue, improved integration of scaffold structure, and decreased protein expression of VCAM-1 and ICAM-1. CMCS could protect LSECs from injury and maintain the microvasculature integration in acute injured liver of mice induced by LPS/D-GalN. Its action mechanism was associated with the down-regulation of MMP-2/9 activities and inhibition of peroxidation in injured liver.
24477591	The -930A>G polymorphism of the CYBA gene is associated with premature coronary artery disease. A case-control study and gene-risk factors interactions.	Reactive oxygen species (ROS) are involved in the pathogenesis of atherosclerosis and coronary artery disease (CAD). NADPH oxidases are the main source of ROS in the vasculature. p22phox is a critical component of vascular NADPH oxidases and is encoded by the CYBA (cytochrome b245 alpha) gene. The -930A>G CYBA polymorphism (rs9932581:A>G) modulates the activity of the CYBA promoter, and influences CYBA transcriptional activity. The aim of the present study was to analyze a possible association between the -930A>G polymorphism and CAD and to search for gene-traditional risk factors interactions. 480 subjects were studied: 240 patients with premature CAD, 240 age and sex matched blood donors. The -930A>G polymorphism was genotyped using the TaqMan - Pre-designed SNP Genotyping Assay (Applied Biosystems). The -930G allele carrier state was a risk factor for CAD (OR 2.03, 95% CI 1.21-3.44, P=0.007). A synergistic effect of the -930G allele with overweight/obesity (BMI --25) and cigarette smoking was found. The estimated CAD risk for BMI --25 and the -930G allele interaction was about 160% greater than that predicted by assuming additivity of the effects, and about 40% greater for interaction of cigarette smoking and the -930G allele. Overweight/obesity was a risk factor for CAD only in the -930G allele carriers (P<10(-10)) but not in the AA homozygotes (P=1.00). In conclusion the -930A>G CYBA polymorphism is associated with CAD in the Polish population. The -930G allele carriers are particularly at risk of consequences of obesity and tobacco smoke exposure.
24587916	Antioxidant effects of bovine lactoferrin on dexamethasone-induced hypertension in rat.	Dexamethasone- (Dex-) induced hypertension is associated with enhanced oxidative stress. Lactoferrin (LF) is an iron-binding glycoprotein with antihypertensive properties. In this study, we investigated the effect of chronic administration of LF on oxidative stress and hypertension upon Dex administration. Male Wistar rats were treated by Dex (30  u g/kg/day subcutaneously) or saline for 14 days. Oral bovine LF (30, 100, 300 mg/kg) was given from day 8 to 14 in a reversal study. In a prevention study, rats received 4 days of LF treatment followed by Dex and continued during the test period. Systolic blood pressure (SBP) was measured using tail-cuff method. Thymus weight was used as a marker of glucocorticoid activity. Plasma hydrogen peroxide (H2O2) concentration and ferric reducing antioxidant power (FRAP) value were determined. Dexamethasone significantly increased SBP and plasma H2O2 level and decreased thymus and body weights. LF lowered (P < 0.01) and dose dependently prevented (P < 0.001) Dex-induced hypertension. LF prevented body weight loss and significantly reduced the elevated plasma H2O2 and increased FRAP values. Chronic administration of LF strongly reduced the blood pressure and production of ROS and improved antioxidant capacity in Dex-induced hypertension, suggesting the role of inhibition of oxidative stress as another mechanism of antihypertensive action of LF.
24588023	The association between tranexamic acid and convulsive seizures after cardiac surgery: a multivariate analysis in 11 529 patients.	Because of a lack of contemporary data regarding seizures after cardiac surgery, we undertook a retrospective analysis of prospectively collected data from 11 529 patients in whom cardiopulmonary bypass was used from January 2004 to December 2010. A convulsive seizure was defined as a transient episode of disturbed brain function characterised by abnormal involuntary motor movements. Multivariate regression analysis was performed to identify independent predictors of postoperative seizures. A total of 100 (0.9%) patients developed postoperative convulsive seizures. Generalised and focal seizures were identified in 68 and 32 patients, respectively. The median (IQR [range]) time after surgery when the seizure occurred was 7 (6-12 [1-216]) h and 8 (6-11 [4-18]) h, respectively. Epileptiform findings on electroencephalography were seen in 19 patients. Independent predictors of postoperative seizures included age, female sex, redo cardiac surgery, calcification of ascending aorta, congestive heart failure, deep hypothermic circulatory arrest, duration of aortic cross-clamp and tranexamic acid. When tested in a multivariate regression analysis, tranexamic acid was a strong independent predictor of seizures (OR 14.3, 95% CI 5.5-36.7; p < 0.001). Patients with convulsive seizures had 2.5 times higher in-hospital mortality rates and twice the length of hospital stay compared with patients without convulsive seizures. Mean (IQR [range]) length of stay in the intensive care unit was 115 (49-228 [32-481]) h in patients with convulsive seizures compared with 26 (22-69 [14-1080]) h in patients without seizures (p < 0.001). Convulsive seizures are a serious postoperative complication after cardiac surgery. As tranexamic acid is the only modifiable factor, its administration, particularly in doses exceeding 80 mg.kg(-1), should be weighed against the risk of postoperative seizures.
24623966	Endothelial NADPH oxidase 4 mediates vascular endothelial growth factor receptor 2-induced intravitreal neovascularization in a rat model of retinopathy of prematurity.	PURPOSE: NADPH oxidase-generated reactive oxygen species (ROS) are implicated in angiogenesis. Isoforms of NADPH oxidase NOX1, NOX2, and NOX4 are reported to be expressed in endothelial cells (ECs). Of these, NOX1 and NOX2 have been reported to contribute to intravitreal neovascularization (IVNV) in oxygen-induced retinopathy (OIR) models. In this study, we tested the hypothesis that the isoform NOX4 in ECs contributed to vascular endothelial growth factor (VEGF)-induced angiogenesis and IVNV. METHODS: Isoforms of NADPH oxidase MRNA were measured in several types of cultured vascular ecs: human retinal microvascular ECs (hRMVECs), choroidal ECs (CECs), and human umbilical vascular ECs (HUVECs) using real-time PCR. Newborn rat pups and dams were placed into an OIR model that cycled oxygen concentration between 50% and 10% every 24 h for 14 days, and then were placed in room air (RA) for an additional 4 days (rat OIR model). NOX4 expression in retinal lysates from the RA-raised pups at postnatal day 0 (P0), P14, and P18 was determined with western blots. STAT3 activation was determined as the ratio of phosphorylated STAT3 to total STAT3 with western blot analysis of retinal lysates from pups raised in RA or from the rat OIR model at P18. Semiquantitative assessment of the density of NOX4 colabeling with lectin-stained retinal ECs was determined by immunolabeling of retinal cryosections from P18 pups in OIR or in RA. In hRMVECs transfected with NOX4 siRNA and treated with VEGF or control, 1) ROS generation was measured using the 5-(and-6)-chloromethyl-2',7'-dichlorodihydrofluorescein diacetate, acetyl ester fluorescence assay and 2) phosphorylated VEGF receptor 2 and STAT3, and total VEGFR2 and STAT3 were measured in western blot analyses. VEGF-stimulated hRMVEC proliferation was measured following transfection with NOX4 siRNA or STAT3 siRNA, or respective controls. RESULTS: NOX4 was the most prevalent isoform of NADPH oxidase in vascular ECs. NOX4 expression in retinal lysates was significantly decreased during development in RA. Compared to RA, the expression of retinal NOX4 increased at P18. At p18 OIR, semiquantitative assessment of the density of lectin and NOX4 colabeling in retinal vascular ECs was greater in retinal cryosections and activated STAT3 was greater in retinal lysates when compared to the RA-raised pups. In cultured hRMVECs, knockdown of NOX4 by siRNA transfection inhibited VEGF-induced ROS generation. VEGF induced a physical interaction of phosphorylated-VEGFR2 and NOX4. Knockdown of NOX4: 1) reduced VEGFR2 activation but did not abolish it and 2) abolished STAT3 activation in response to VEGF. Knockdown of either NOX4 or STAT3 inhibited VEGF-induced EC proliferation. CONCLUSIONS: Our data suggest that in a model representative of human retinopathy of prematurity, NOX4 was increased at a time point when IVNV developed. VEGF-activated NOX4 led to an interaction between VEGF-activated VEGFR2 and NOX4 that mediated EC proliferation via activation of STAT3. Altogether, our results suggest that NOX4 may regulate VEGFR2-mediated IVNV through activated STAT3.
24632946	Disruption of the temporally regulated cloaca endodermal b-catenin signaling causes anorectal malformations.	The cloaca is temporally formed and eventually divided by the urorectal septum (URS) during urogenital and anorectal organ development. Although congenital malformations, such as anorectal malformations (ARMs), are frequently observed during this process, the underlying pathogenic mechanisms remain unclear. b-Catenin is a critical component of canonical Wnt signaling and is essential for the regulation of cell differentiation and morphogenesis during embryogenesis. The expression of b-catenin is observed in endodermal epithelia, including URS epithelia. We modulated the b-catenin gene conditionally in endodermal epithelia by utilizing tamoxifen-inducible Cre driver line (Shh(CreERT2)). Both b-catenin loss- and gain-of-function (LOF and GOF) mutants displayed abnormal clefts in the perineal region and hypoplastic elongation of the URS. The mutants also displayed reduced cell proliferation in the URS mesenchyme. In addition, the b-catenin GOF mutants displayed reduced apoptosis and subsequently increased apoptosis in the URS epithelium. This instability possibly resulted in reduced expression levels of differentiation markers, such as keratin 1 and filaggrin, in the perineal epithelia. The expression of bone morphogenetic protein (Bmp) genes, such as Bmp4 and Bmp7, was also ectopically induced in the epithelia of the URS in the b-catenin GOF mutants. The expression of the Msx2 gene and phosphorylated-Smad1/5/8, possible readouts of Bmp signaling, was also increased in the mutants. Moreover, we introduced an additional mutation for a Bmp receptor gene: BmprIA. The Shh(CreERT2/+); b-catenin(flox(ex3)/+); BmprIA(flox/-) mutants displayed partial restoration of URS elongation compared with the b-catenin GOF mutants. These results indicate that some ARM phenotypes in the b-catenin GOF mutants were caused by abnormal Bmp signaling. The current analysis revealed the close relation of endodermal b-catenin signaling to the ARM phenotypes. These results are considered to shed light on the pathogenic mechanisms of human ARMs.
24671324	Necrotising fasciitis after bortezomib and dexamethasone-containing regimen in an elderly patient of Waldenstrom macroglobulinaemia.	Bortezomib and high-dose dexamethasone-containing regimens are considered to be generally tolerable with few severe bacterial infections in patients with B-cell malignancies. However, information is limited concerning the safety of the regimen in elderly patients. We report a case of a 76-year-old man with Waldenstrom macroglobulinaemia who suffered necrotising fasciitis without neutropenia after the combination treatment with bortezomib, high-dose dexamethasone and rituximab. Despite immediate intravenous antimicrobial therapy, he succumbed 23 h after the onset. Physicians should recognise the possibility of fatal bacterial infections related to bortezomib plus high-dose dexamethasone in elderly patients, and we believe this case warrants further investigation.
24709919	Effects of ginsenosides on opioid-induced hyperalgesia in mice.	Opioid-induced hyperalgesia (OIH) is characterized by nociceptive sensitization caused by the cessation of chronic opioid use. OIH can limit the clinical use of opioid analgesics and complicate withdrawal from opioid addiction. In this study, we investigated the effects of Re, Rg1, and Rb1 ginsenosides, the bioactive components of ginseng, on OIH. OIH was achieved in mice after subcutaneous administration of morphine for 7 consecutive days three times per day. During withdrawal (days 8 and 9), these mice were administered Re, Rg1, or Rb1 intragastrically two times per day. On the test day (day 10), mice were subjected to the thermal sensitivity test and the acetic acid-induced writhing test. Re (300 mg/kg) inhibited OIH in both the thermal sensitivity test and the acetic acid-induced writhing test. However, the Rg1 and Rb1 ginsenosides failed to prevent OIH in either test. Furthermore, Rg1 showed a tendency to aggravate OIH in the acetic acid-induced writhing test. Our data suggested that the ginsenoside Re, but not Rg1 or Rb1, may contribute toward reversal of OIH.
24742750	Availability of human induced pluripotent stem cell-derived cardiomyocytes in assessment of drug potential for QT prolongation.	Field potential duration (FPD) in human-induced pluripotent stem cell-derived cardiomyocytes (hiPS-CMs), which can express QT interval in an electrocardiogram, is reported to be a useful tool to predict K(+) channel and Ca(2+) channel blocker effects on QT interval. However, there is no report showing that this technique can be used to predict multichannel blocker potential for QT prolongation. The aim of this study is to show that FPD from MEA (Multielectrode array) of hiPS-CMs can detect QT prolongation induced by multichannel blockers. hiPS-CMs were seeded onto MEA and FPD was measured for 2min every 10min for 30min after drug exposure for the vehicle and each drug concentration. IKr and IKs blockers concentration-dependently prolonged corrected FPD (FPDc), whereas Ca(2+) channel blockers concentration-dependently shortened FPDc. Also, the multichannel blockers Amiodarone, Paroxetine, Terfenadine and Citalopram prolonged FPDc in a concentration dependent manner. Finally, the IKr blockers, Terfenadine and Citalopram, which are reported to cause Torsade de Pointes (TdP) in clinical practice, produced early afterdepolarization (EAD). hiPS-CMs using MEA system and FPDc can predict the effects of drug candidates on QT interval. This study also shows that this assay can help detect EAD for drugs with TdP potential.
24743235	IL-3 and CSF-1 interact to promote generation of CD11c+ IL-10-producing macrophages.	Unraveling the mechanisms of hematopoiesis regulated by multiple cytokines remains a challenge in hematology. IL-3 is an allergic cytokine with the multilineage potential, while CSF-1 is produced in the steady state with restricted lineage coverage. Here, we uncovered an instructive role of CSF-1 in IL-3-mediated hematopoiesis. CSF-1 significantly promoted IL-3-driven CD11c+ cell expansion and dampened basophil and mast cell generation from C57BL/6 bone marrow. Further studies indicated that the CSF-1/CSF-1R axis contributed significantly to IL-3-induced CD11c+ cell generation through enhancing c-Fos-associated monopoiesis. CD11c+ cells induced by IL-3 or IL-3/CSF-1 were competent in cellular maturation and endocytosis. Both IL-3 and IL-3/CSF-1 cells lacked classical dendritic cell appearance and resembled macrophages in morphology. Both populations produced a high level of IL-10, in addition to IL-1, IL-6 and TNFa, in response to LPS, and were relatively poor T cell stimulators. Collectively, these findings reveal a role for CSF-1 in mediating the IL-3 hematopoietic pathway through monopoiesis, which regulates expansion of CD11c+ macrophages.
24840785	Aconitine-induced Ca2+ overload causes arrhythmia and triggers apoptosis through p38 MAPK signaling pathway in rats.	Aconitine is a major bioactive diterpenoid alkaloid with high content derived from herbal aconitum plants. Emerging evidence indicates that voltage-dependent Na(+) channels have pivotal roles in the cardiotoxicity of aconitine. However, no reports are available on the role of Ca(2+) in aconitine poisoning. In this study, we explored the importance of pathological Ca(2+) signaling in aconitine poisoning in vitro and in vivo. We found that Ca(2+) overload lead to accelerated beating rhythm in adult rat ventricular myocytes and caused arrhythmia in conscious freely moving rats. To investigate effects of aconitine on myocardial injury, we performed cytotoxicity assay in neonatal rat ventricular myocytes (NRVMs), as well as measured lactate dehydrogenase level in the culture medium of NRVMs and activities of serum cardiac enzymes in rats. The results showed that aconitine resulted in myocardial injury and reduced NRVMs viability dose-dependently. To confirm the pro-apoptotic effects, we performed flow cytometric detection, cardiac histology, transmission electron microscopy and terminal deoxynucleotidyl transferase-mediated dUTP-biotin nick end labeling assay. The results showed that aconitine stimulated apoptosis time-dependently. The expression analysis of Ca(2+) handling proteins demonstrated that aconitine promoted Ca(2+) overload through the expression regulation of Ca(2+) handling proteins. The expression analysis of apoptosis-related proteins revealed that pro-apoptotic protein expression was upregulated, and anti-apoptotic protein BCL-2 expression was downregulated. Furthermore, increased phosphorylation of MAPK family members, especially the P-P38/P38 ratio was found in cardiac tissues. Hence, our results suggest that aconitine significantly aggravates Ca(2+) overload and causes arrhythmia and finally promotes apoptotic development via phosphorylation of P38 mitogen-activated protein kinase.
24842192	Chronic treatment with metformin suppresses toll-like receptor 4 signaling and attenuates left ventricular dysfunction following myocardial infarction.	Acute treatment with metformin has a protective effect in myocardial infarction by suppression of inflammatory responses due to activation of AMP-activated protein kinase (AMPK). In the present study, the effect of chronic pre-treatment with metformin on cardiac dysfunction and toll-like receptor 4 (TLR4) activities following myocardial infarction and their relation with AMPK were assessed. Male Wistar rats were randomly assigned to one of 5 groups (n=6): normal control and groups were injected isoproterenol after chronic pre-treatment with 0, 25, 50, or 100mg/kg of metformin twice daily for 14 days. Isoproterenol (100mg/kg) was injected subcutaneously on the 13th and 14th days to induce acute myocardial infarction. Isoproterenol alone decreased left ventricular systolic pressure and myocardial contractility indexed as LVdp/dtmax and LVdp/dtmin. The left ventricular dysfunction was significantly lower in the groups treated with 25 and 50mg/kg of metformin. Metfromin markedly lowered isoproterenol-induced elevation in the levels of TLR4 mRNA, myeloid differentiation protein 88 (MyD88), tumor necrosis factor-alpha (TNF-a), and interleukin 6 (IL-6) in the heart tissues. Similar changes were also seen in the serum levels of TNF-a and IL-6. However, the lower doses of 25 and 50mg/kg were more effective than 100mg/kg. Phosphorylated AMPKa (p-AMPK) in the myocardium was significantly elevated by 25mg/kg of metformin, slightly by 50mg/kg, but not by 100mg/kg. Chronic pre-treatment with metformin reduces post-myocardial infarction cardiac dysfunction and suppresses inflammatory responses, possibly through inhibition of TLR4 activities. This mechanism can be considered as a target to protect infarcted myocardium.
24911645	Behavioral and neurochemical studies in mice pretreated with garcinielliptone FC in pilocarpine-induced seizures.	Garcinielliptone FC (GFC) isolated from hexanic fraction seed extract of species Platonia insignis Mart. It is widely used in folk medicine to treat skin diseases in both humans and animals as well as the seed decoction has been used to treat diarrheas and inflammatory diseases. However, there is no research on GFC effects in the central nervous system of rodents. The present study aimed to evaluate the GFC effects at doses of 25, 50 or 75 mg/kg on seizure parameters to determine their anticonvulsant activity and its effects on amino acid (r-aminobutyric acid (GABA), glutamine, aspartate and glutathione) levels as well as on acetylcholinesterase (AChE) activity in mice hippocampus after seizures. GFC produced an increased latency to first seizure, at doses 25mg/kg (20.12 + 2.20 min), 50mg/kg (20.95 + 2.21 min) or 75 mg/kg (23.43 + 1.99 min) when compared with seized mice. In addition, GABA content of mice hippocampus treated with GFC75 plus P400 showed an increase of 46.90% when compared with seized mice. In aspartate, glutamine and glutamate levels detected a decrease of 5.21%, 13.55% and 21.80%, respectively in mice hippocampus treated with GFC75 plus P400 when compared with seized mice. Hippocampus mice treated with GFC75 plus P400 showed an increase in AChE activity (63.30%) when compared with seized mice. The results indicate that GFC can exert anticonvulsant activity and reduce the frequency of installation of pilocarpine-induced status epilepticus, as demonstrated by increase in latency to first seizure and decrease in mortality rate of animals. In conclusion, our data suggest that GFC may influence in epileptogenesis and promote anticonvulsant actions in pilocarpine model by modulating the GABA and glutamate contents and of AChE activity in seized mice hippocampus. This compound may be useful to produce neuronal protection and it can be considered as an anticonvulsant agent.
24914936	Thyroid hormone receptor a mutation causes a severe and thyroxine-resistant skeletal dysplasia in female mice.	A new genetic disorder has been identified that results from mutation of THRA, encoding thyroid hormone receptor a1 (TRa1). Affected children have a high serum T3:T4 ratio and variable degrees of intellectual deficit and constipation but exhibit a consistently severe skeletal dysplasia. In an attempt to improve developmental delay and alleviate symptoms of hypothyroidism, patients are receiving varying doses and durations of T4 treatment, but responses have been inconsistent so far. Thra1(PV/+) mice express a similar potent dominant-negative mutant TRa1 to affected individuals, and thus represent an excellent disease model. We hypothesized that Thra1(PV/+) mice could be used to predict the skeletal outcome of human THRA mutations and determine whether prolonged treatment with a supraphysiological dose of T4 ameliorates the skeletal abnormalities. Adult female Thra1(PV/+) mice had short stature, grossly abnormal bone morphology but normal bone strength despite high bone mass. Although T4 treatment suppressed TSH secretion, it had no effect on skeletal maturation, linear growth, or bone mineralization, thus demonstrating profound tissue resistance to thyroid hormone. Despite this, prolonged T4 treatment abnormally increased bone stiffness and strength, suggesting the potential for detrimental consequences in the long term. Our studies establish that TRa1 has an essential role in the developing and adult skeleton and predict that patients with different THRA mutations will display variable responses to T4 treatment, which depend on the severity of the causative mutation.
