abstract_id	title	abstract
16410744	Genetic alterations in primary glioblastomas in Japan.	Current knowledge of genetic alterations in glioblastomas is based largely on genetic analyses of tumors from mainly caucasian patients in the United States and Europe. In the present study, screening for several key genetic alterations was performed on 77 primary (de novo) glioblastomas in Japanese patients. SSCP followed by DNA sequencing revealed TP53 mutations in 16 of 73 (22%) glioblastomas and PTEN mutations in 13 of 63 (21%) cases analyzed. Polymerase chain reaction (PCR) showed EGFR amplification in 25 of 77 (32%) cases and p16 homozygous deletion in 32 of 77 (42%) cases. Quantitative microsatellite analysis revealed LOH 10q in 41 of 59 (69%) glioblastomas. The frequencies of these genetic alterations were similar to those reported for primary glioblastomas at the population level in Switzerland. As previously observed for glioblastomas in Europe, there was a positive association between EGFR amplification and p16 deletion (p=0.009), whereas there was an inverse association between TP53 mutations and p16 deletion (p=0.049) in glioblastomas in Japan. Multivariate analyses showed that radiotherapy was significantly predictive for longer survival of glioblastoma patients (p=0.002). SSCP followed by DNA sequencing of the kinase domain (exons 18-21) of the EGFR gene revealed mutations in 2 ou of 69 (3%) glioblastomas in Japan and in 4 of 81 (5%) glioblastomas in Switzerland. The allele frequencies of polymorphisms at codon 787 CAG/CAA (Gln/Gln) in glioblastomas in Japan were G/G (82.4%), G/A (10.8%), A/A (6.8%), corresponding to G 0.878 versus A 0.122, significantly different from those in glioblastomas in Switzerland: G/G (27.2%), G/A (28.4%), A/A (44.4%), corresponding to G 0.414 versus A 0.586 (p < 0.0001). These results suggest that primary glioblastomas in Japan show genetic alterations similar to those in Switzerland, suggesting a similar molecular basis in caucasians and Asians, despite different genetic backgrounds, including different status of a polymorphism in the EGFR gene.
16412238	Peroxisomal proliferator activated receptor-gamma deficiency in a Canadian kindred with familial partial lipodystrophy type 3 (FPLD3).	BACKGROUND: Familial partial lipodystrophy (Dunnigan) type 3 (FPLD3, Mendelian Inheritance in Man [MIM] 604367) results from heterozygous mutations in PPARG encoding peroxisomal proliferator-activated receptor-gamma. Both dominant-negative and haploinsufficiency mechanisms have been suggested for this condition. METHODS: We present a Canadian FPLD3 kindred with an affected mother who had loss of fat on arms and legs, but no increase in facial, neck, suprascapular or abdominal fat. She had profound insulin resistance, diabetes, severe hypertriglyceridemia and relapsing pancreatitis, while her pre-pubescent daughter had normal fat distribution but elevated plasma triglycerides and C-peptide and depressed high-density lipoprotein cholesterol. RESULTS: The mother and daughter were each heterozygous for PPARG nonsense mutation Y355X, whose protein product in vitro was transcriptionally inactive with no dominant-negative activity against the wild-type receptor. In addition the mutant protein appeared to be markedly unstable. CONCLUSION: Taken together with previous studies of human PPARG mutations, these findings suggest that PPAR-gamma deficiency due either to haploinsufficiency or to substantial activity loss due to dominant negative interference of the normal allele product's function can each contribute to the FPLD3 phenotype.
16418600	Genetic investigation of the TSPYL1 gene in sudden infant death syndrome.	BACKGROUND: Sudden infant death syndrome (SIDS) constitutes the most frequent cause of death in the postperinatal period in Germany. Recently, a lethal phenotype characterized by sudden infant death with dysgenesis of the testes syndrome (SIDDT) was identified to be caused by loss of function mutations in the TSPYL1 gene. PURPOSE: The study's purpose was to reveal a possible role of TSPYL1 in SIDS. METHODS: DNA samples of 126 SIDS cases and 261 controls were investigated. RESULTS: We found five sequence variations, each of them causing an amino acid substitution. No Hardy Weinberg disequilibrium and no significant difference in allele frequencies between patients and controls were observed for any variation. In one female patient a p.F366L amino acid polymorphism was found heterozygous, which could not be displayed in controls. A pathogenic implication of this substitution, which is conserved in primates and rodents, cannot be ruled out completely. Because SIDDT is the result of homozygous TSPYL1 mutations, this heterozygous exchange cannot solely explain the sudden death in this child. The reported mutation associated with SIDDT (457_458insG) was not detectable in our cohort. CONCLUSION: No association of sequence variations in the TSPYL1 gene and SIDS has been found in a German cohort. Genetic analysis of TSPYL1 seems to be of limited significance in the differential diagnosis of SIDS without dysgenesis of the testes.
16506214	Genetic variation in the COX-2 gene and the association with prostate cancer risk.	COX-2 is a key enzyme in the conversion of arachidonic acid to prostaglandins. The prostaglandins produced by COX-2 are involved in inflammation and pain response in different tissues in the body. Accumulating evidence from epidemiologic studies, chemical carcinogen-induced rodent models and clinical trials indicate that COX-2 plays a role in human carcinogenesis and is overexpressed in prostate cancer tissue. We examined whether sequence variants in the COX-2 gene are associated with prostate cancer risk. We analyzed a large population-based case-control study, cancer prostate in Sweden (CAPS) consisting of 1,378 cases and 782 controls. We evaluated 16 single nucleotide polymorphisms (SNPs) spanning the entire COX-2 gene in 94 subjects of the control group. Five SNPs had a minor allele frequency of more than 5% in our study population and these were genotyped in all case patients and control subjects and gene-specific haplotypes were constructed. A statistically significant difference in allele frequency between cases and controls was observed for 2 of the SNPs (+3100 T/G and +8365 C/T), with an odds ratio of 0.78 (95% CI=0.64-0.96) and 0.65 (95% CI=0.45-0.94) respectively. In the haplotype analysis, 1 haplotype carrying the variant allele from both +3100 T/G and +8365 C/T, with a population frequency of 3%, was also significantly associated with decreased risk of prostate cancer (p=0.036, global simulated p-value=0.046). This study supports the hypothesis that inflammation is involved in prostate carcinogenesis and that sequence variation within the COX-2 gene influence the risk of prostate cancer.
16526029	Evaluation of RGS4 as a candidate gene for schizophrenia.	Several studies have suggested that the regulator of G-protein signaling 4 (RGS4) may be a positional and functional candidate gene for schizophrenia. Three single nucleotide polymorphisms (SNP) located at the promoter region (SNP4 and SNP7) and the intron 1 (SNP18) of RGS4 have been verified in different ethnic groups. Positive results have been reported in these SNPs with different numbers of SNP combinatory haplotypes. In this study, these three SNP markers were genotyped in 218 schizophrenia pedigrees of Taiwan (864 individuals) for association analysis. Among these three SNPs, neither SNP4, SNP7, SNP18 has shown significant association with schizophrenia in single locus association analysis, nor any compositions of the three SNP haplotypes has shown significantly associations with the DSM-IV diagnosed schizophrenia. Our results fail to support the RGS4 as a candidate gene for schizophrenia when evaluated from these three SNP markers.
16541406	Distinct patterns of germ-line deletions in MLH1 and MSH2: the implication of Alu repetitive element in the genetic etiology of Lynch syndrome (HNPCC).	A relatively high frequency of germ-line genomic rearrangements in MLH1 and MSH2 has been reported among Lynch Syndrome (HNPCC) patients from different ethnic populations. To investigate the underlying molecular mechanisms, we characterized the DNA breakpoints of 11 germ-line deletions, six for MLH1 and five for MSH2. Distinct deletion patterns were found for the two genes. The five cases of MSH2 deletions result exclusively from intragenic unequal recombination mediated by repetitive Alu sequences. In contrast, five out of the six MLH1 deletions are due to recombinations involving sequences of no significant homology (P=0.015). A detailed analysis of the DNA breakpoints in the two genes, previously characterized by other groups, validated the observation that Alu-mediated unequal recombination is the main type of deletion in MSH2 (n=34), but not in MLH1 (n=21) (P<0.0001). Plotting the distribution of known DNA breakpoints among the introns of the two genes showed that, the highest breakpoint density is co-localized with the highest Alu density. Our study suggests that Alu is a promoting factor for the genomic recombinations in both MLH1 and MSH2, and the local Alu density may be involved in shaping the deletion pattern.
16574712	MDMA polydrug users show process-specific central executive impairments coupled with impaired social and emotional judgement processes.	"In recent years working memory deficits have been reported in users of MDMA (3,4-methylenedioxymethamphetamine, ecstasy). The current study aimed to assess the impact of MDMA use on three separate central executive processes (set shifting, inhibition and memory updating) and also on ""prefrontal"" mediated social and emotional judgement processes. Fifteen polydrug ecstasy users and 15 polydrug non-ecstasy user controls completed a general drug use questionnaire, the Brixton Spatial Anticipation task (set shifting), Backward Digit Span procedure (memory updating), Inhibition of Return (inhibition), an emotional intelligence scale, the Tromso Social Intelligence Scale and the Dysexecutive Questionnaire (DEX). Compared with MDMA-free polydrug controls, MDMA polydrug users showed impairments in set shifting and memory updating, and also in social and emotional judgement processes. The latter two deficits remained significant after controlling for other drug use. These data lend further support to the proposal that cognitive processes mediated by the prefrontal cortex may be impaired by recreational ecstasy use."
16574713	Memory function and serotonin transporter promoter gene polymorphism in ecstasy (MDMA) users.	"Although 3,4-methylenedioxymethamphetamine (MDMA or ecstasy) has been shown to damage brain serotonin (5-HT) neurons in animals and possibly humans, little is known about the long-term consequences of MDMA-induced 5-HT neurotoxic lesions on functions in which 5-HT is involved, such as cognitive function. Because 5-HT transporters play a key element in the regulation of synaptic 5-HT transmission it may be important to control for the potential covariance effect of a polymorphism in the 5-HT transporter promoter gene region (5-HTTLPR) when studying the effects of MDMA as well as cognitive functioning. The aim of the study was to investigate the effects of moderate and heavy MDMA use on cognitive function, as well as the effects of long-term abstention from MDMA, in subjects genotyped for 5-HTTLPR. A second aim of the study was to determine whether these effects differ for females and males. Fifteen moderate MDMA users (<55 lifetime tablets), 22 heavy MDMA+ users (>55 lifetime tablets), 16 ex-MDMA+ users (last tablet > 1 year ago) and 13 controls were compared on a battery of neuropsychological tests. DNA from peripheral nuclear blood cells was genotyped for 5-HTTLPR using standard polymerase chain reaction methods.A significant group effect was observed only on memory function tasks (p = 0.04) but not on reaction times (p = 0.61) or attention/executive functioning (p = 0.59). Heavy and ex-MDMA+ users performed significantly poorer on memory tasks than controls. In contrast, no evidence of memory impairment was observed in moderate MDMA users. No significant effect of 5-HTTLPR or gender was observed. While the use of MDMA in quantities that may be considered ""moderate"" is not associated with impaired memory functioning, heavy use of MDMA use may lead to long lasting memory impairments. No effect of 5-HTTLPR or gender on memory function or MDMA use was observed."
16575011	Tumor thymidylate synthase 1494del6 genotype as a prognostic factor in colorectal cancer patients receiving fluorouracil-based adjuvant treatment.	PURPOSE: The purpose of this study was to analyze the value of germline and tumor thymidylate synthase (TS) genotyping as a prognostic marker in a series of colorectal cancer patients receiving adjuvant fluorouracil (FU) -based treatment. PATIENTS AND METHODS: One hundred twenty-nine colorectal cancer patients homogeneously treated with FU plus levamisole or leucovorin in the adjuvant setting were included. TS enhancer region, 3R G > C single nucleotide polymorphism (SNP), and TS 1494del6 polymorphisms were assessed in both fresh-frozen normal mucosa and tumor. Mutational analyses of TS and allelic imbalances were studied in all primary tumors and in 18 additional metachronic metastases. TS protein immunostaining was assessed in an expanded series of 214 tumors. Multivariate Cox models were adjusted for stage, differentiation, and location. RESULTS: Tumor genotyping (frequency of allelic loss, 26%) showed that the 3R/3R genotype was associated with a better outcome (hazard ratio [HR] = 0.38; 95% CI, 0.16 to 0.93; P = .020 for the recessive model). 3R G > C SNP genotyping did not add prognostic information. Tumor TS 1494del6 allele (frequency of allelic loss, 36%) was protective (for each allele with the deletion, based on an additive model, HR = 0.42; 95% CI, 0.22 to 0.82; P = .0034). Both polymorphisms were in strong linkage disequilibrium (D' = 0.71, P < .001), and the 3R/-6 base pair (bp) haplotype showed a significant overall survival benefit compared with the most prevalent haplotype 2R/+6bp (HR = 0.42; 95% CI, 0.20 to 0.85; P = .017). No TS point mutation was detected in primary tumors or metastases. TS protein immunostaining was not associated with survival or any of the genotypes analyzed. CONCLUSION: Tumor TS 1494del6 genotype may be a prognostic factor in FU-based adjuvant treatment of colorectal cancer patients.
16596970	Pilocarpine seizures cause age-dependent impairment in auditory location discrimination.	Children who have status epilepticus have continuous or rapidly repeating seizures that may be life-threatening and may cause life-long changes in brain and behavior. The extent to which status epilepticus causes deficits in auditory discrimination is unknown. A naturalistic auditory location discrimination method was used to evaluate this question using an animal model of status epilepticus. Male Sprague-Dawley rats were injected with saline on postnatal day (P) 20, or a convulsant dose of pilocarpine on P20 or P45. Pilocarpine on either day induced status epilepticus; status epilepticus at P45 resulted in CA3 cell loss and spontaneous seizures, whereas P20 rats had no cell loss or spontaneous seizures. Mature rats were trained with sound-source location and sound-silence discriminations. Control (saline P20) rats acquired both discriminations immediately. In status epilepticus (P20) rats, acquisition of the sound-source location discrimination was moderately impaired. Status epilepticus (P45) rats failed to acquire either sound-source location or sound-silence discriminations. Status epilepticus in rat causes an age-dependent, long-term impairment in auditory discrimination. This impairment may explain one cause of impaired auditory location discrimination in humans.
16611040	Gene therapy for cystic fibrosis airway disease- is clinical success imminent?	Cystic fibrosis (CF) was one of the first inherited disorders for which gene therapy was seriously considered as a realistic option for treatment, and as such, it has long provided a paradigm for gene therapy of inherited diseases. However, despite the cloning of the cystic fibrosis transmembrane conductance regulator gene in 1989, over 15 years later a practical gene therapy for CF has not eventuated. There are a number of reasons for this, and analysis of the specific issues that have delayed the successful development of gene therapy for CF also provides general insights into the practical complexities involved in the development of gene therapy for inherited disorders. The issues which have prevented the application of gene therapy for CF to date include the lack of suitable gene delivery technologies, the complexities of the interactions between the host and vector, the biology of the lung airways, and the nature of the pathology found in individuals with CF. We will discuss the history of CF gene therapy with specific reference to these and other issues that pre-occupy the field at present: namely, the question of what vectors appear to be suitable for airway gene delivery in CF, what cells must be targeted, how airway epithelium defences can be overcome or eluded to allow efficient gene delivery, how to ensure safe and long-term transgene expression and the need to identify relevant surrogate success measures that can be used to assess the outcome of gene therapy in CF patients.
16720068	Possible neuroleptic malignant syndrome related to concomitant treatment with paroxetine and alprazolam.	A 74-year-old man with depressive symptoms was admitted to a psychiatric hospital due to insomnia, loss of appetite, exhaustion, and agitation. Medical treatment was initiated at a daily dose of 20 mg paroxetine and 1.2 mg alprazolam. On the 10th day of paroxetine and alprazolam treatment, the patient exhibited marked psychomotor retardation, disorientation, and severe muscle rigidity with tremors. The patient had a fever (38.2 degrees C), fluctuating blood pressure (between 165/90 and 130/70 mg mm Hg), and severe extrapyramidal symptoms. Laboratory tests showed an elevation of creatine phosphokinase (2218 IU/L), aspartate aminotransferase (134 IU/L), alanine aminotransferase (78 IU/L), and BUN (27.9 mg/ml) levels. The patient received bromocriptine and diazepam to treat his symptoms. 7 days later, the fever disappeared and the patient's serum CPK levels were normalized (175 IU/L). This patient presented with symptoms of neuroleptic malignant syndrome (NMS), thus demonstrating that NMS-like symptoms can occur after combined paroxetine and alprazolam treatment. The adverse drug reaction score obtained by the Naranjo algorithm was 6 in our case, indicating a probable relationship between the patient's NMS-like adverse symptoms and the combined treatment used in this case. The involvement of physiologic and environmental aspects specific to this patient was suspected. Several risk factors for NMS should be noted in elderly depressive patients whose symptoms often include dehydration, agitation, malnutrition, and exhaustion. Careful therapeutic intervention is necessary in cases involving elderly patients who suffer from depression.
16781314	Ectodermal dysplasia-skin fragility syndrome resulting from a new homozygous mutation, 888delC, in the desmosomal protein plakophilin 1.	We report an unusual case of an inherited disorder of the desmosomal protein plakophilin 1, resulting in ectodermal dysplasia-skin fragility syndrome. The affected 6-year-old boy had red skin at birth and subsequently developed skin fragility, progressive plantar keratoderma, nail dystrophy, and alopecia. Skin biopsy revealed widening of intercellular spaces in the epidermis and a reduced number of small, poorly formed desmosomes. Mutation analysis of the plakophilin 1 gene PKP1 revealed a homozygous deletion of C at nucleotide 888 within exon 5. This mutation differs from the PKP1 gene pathology reported in 8 previously published individuals with this rare genodermatosis. However, all cases show similar clinical features, highlighting the importance of functional plakophilin 1 in maintaining desmosomal adhesion in skin, as well as the role of this protein in aspects of ectodermal development.
16801510	Drug-induced long QT syndrome in injection drug users receiving methadone: high frequency in hospitalized patients and risk factors.	BACKGROUND: Drug-induced long QT syndrome is a serious adverse drug reaction. Methadone prolongs the QT interval in vitro in a dose-dependent manner. In the inpatient setting, the frequency of QT interval prolongation with methadone treatment, its dose dependence, and the importance of cofactors such as drug-drug interactions remain unknown. METHODS: We performed a systematic, retrospective study comparing active or former intravenous drug users receiving methadone and those not receiving methadone among all patients hospitalized over a 5-year period in a tertiary care hospital. A total of 167 patients receiving methadone fulfilled the inclusion criteria and were compared with a control group of 80 injection drug users not receiving methadone. In addition to methadone dose, 15 demographic, biological, and pharmacological variables were considered as potential risk factors for QT prolongation. RESULTS: Among 167 methadone maintenance patients, the prevalence of QTc prolongation to 0.50 second((1/2)) or longer was 16.2% compared with 0% in 80 control subjects. Six patients (3.6%) in the methadone group presented torsades de pointes. QTc length was weakly but significantly associated with methadone daily dose (Spearman rank correlation coefficient, 0.20; P<.01). Multivariate regression analysis allowed attribution of 31.8% of QTc variability to methadone dose, cytochrome P-450 3A4 drug-drug interactions, hypokalemia, and altered liver function. CONCLUSIONS: QT interval prolongation in methadone maintenance patients hospitalized in a tertiary care center is a frequent finding. Methadone dose, presence of cytochrome P-450 3A4 inhibitors, potassium level, and liver function contribute to QT prolongation. Long QT syndrome can occur with low doses of methadone.
16810074	Mechanisms of hypertension induced by nitric oxide (NO) deficiency: focus on venous function.	Loss of endothelial cell-derived nitric oxide (NO) in hypertension is a hallmark of arterial dysfunction. Experimental hypertension created by the removal of NO, however, involves mechanisms in addition to decreased arterial vasodilator activity. These include augmented endothelin-1 (ET-1) release, increased sympathetic nervous system activity, and elevated tissue oxidative stress. We hypothesized that increased venous smooth muscle (venomotor) tone plays a role in Nomega-nitro-L-arginine (LNNA) hypertension through these mechanisms. Rats were treated with the NO synthase inhibitor LNNA (0.5 g/L in drinking water) for 2 weeks. Mean arterial pressure of conscious rats was 119 +/- 2 mm Hg in control and 194 +/- 5 mm Hg in LNNA rats (P<0.05). Carotid arteries and vena cava were removed for measurement of isometric contraction. Maximal contraction to norepinephrine was modestly reduced in arteries from LNNA compared with control rats whereas the maximum contraction to ET-1 was significantly reduced (54% control). Maximum contraction of vena cava to norepinephrine (37% control) also was reduced but no change in response to ET-1 was observed. Mean circulatory filling pressure, an in vivo measure of venomotor tone, was not elevated in LNNA hypertension at 1 or 2 weeks after LNNA. The superoxide scavenger tempol (30, 100, and 300 micromol kg(-1), IV) did not change arterial pressure in control rats but caused a dose-dependent decrease in LNNA rats (-18 +/- 8, -26 +/- 15, and -54 +/- 11 mm Hg). Similarly, ganglionic blockade with hexamethonium caused a significantly greater fall in LNNA hypertensive rats (76 +/- 9 mm Hg) compared with control rats (35 +/- 10 mm Hg). Carotid arteries, vena cava, and sympathetic ganglia from LNNA rats had higher basal levels of superoxide compared with those from control rats. These data suggest that while NO deficiency increases oxidative stress and sympathetic activity in both arterial and venous vessels, the impact on veins does not make a major contribution to this form of hypertension.
16820346	Atorvastatin prevented and reversed dexamethasone-induced hypertension in the rat.	To assess the antioxidant effects of atorvastatin (atorva) on dexamethasone (dex)-induced hypertension, 60 male Sprague-Dawley rats were treated with atorva 30 mg/kg/day or tap water for 15 days. Dex increased systolic blood pressure (SBP) from 109 +/- 1.8 to 135 +/- 0.6 mmHg and plasma superoxide (5711 +/- 284.9 saline, 7931 +/- 392.8 U/ml dex, P < 0.001). In this prevention study, SBP in the atorva + dex group was increased from 115 +/- 0.4 to 124 +/- 1.5 mmHg, but this was significantly lower than in the dex-only group (P' < 0.05). Atorva reversed dex-induced hypertension (129 +/- 0.6 mmHg, vs. 135 +/- 0.6 mmHg P' < 0.05) and decreased plasma superoxide (7931 +/- 392.8 dex, 1187 +/- 441.2 atorva + dex, P < 0.0001). Plasma nitrate/nitrite (NOx) was decreased in dex-treated rats compared to saline-treated rats (11.2 +/- 1.08 microm, 15.3 +/- 1.17 microm, respectively, P < 0.05). Atorva affected neither plasma NOx nor thymus weight. Thus, atorvastatin prevented and reversed dexamethasone-induced hypertension in the rat.
