abstract_id	title	abstract
19370764	Identification and molecular characterization of six novel mutations in the UDP-N-acetylglucosamine-1-phosphotransferase gamma subunit (GNPTG) gene in patients with mucolipidosis III gamma.	Mucolipidosis type III (MLIII) is an autosomal recessive disorder affecting lysosomal hydrolase trafficking. In a study of 10 patients from seven families with a clinical phenotype and enzymatic diagnosis of MLIII, six novel GNPTG gene mutations were identified. These included missense (p.T286M) and nonsense (p.W111X) mutations and a transition in the obligate AG-dinucleotide of the intron 8 acceptor splice site (c.610-2A>G). Three microdeletions were also identified, two of which (c.611delG and c.640_667del28) were located within the coding region whereas one (c.609+28_610-16del) was located entirely within intron 8. RT-PCR analysis of the c.610-2A>G transition demonstrated that the change altered splicing, leading to the production of two distinct aberrantly spliced forms, viz. the skipping of exon 9 (p.G204_K247del) or the retention of introns 8 and 9 (p.G204VfsX28). RT-PCR analysis, performed on a patient homozygous for the intronic deletion (c.609+28_610-16del), failed to detect any GNPTG RNA transcripts. To determine whether c.609+28_610-16del allele-derived transcripts were subject to nonsense-mediated mRNA decay (NMD), patient fibroblasts were incubated with the protein synthesis inhibitor anisomycin. An RT-PCR fragment retaining 43 bp of intron 8 was consistently detected suggesting that the 33-bp genomic deletion had elicited NMD. Quantitative real-time PCR and GNPTG western blot analysis confirmed that the homozygous microdeletion p.G204VfsX17 had elicited NMD resulting in failure to synthesize GNPTG protein. Analysis of the sequences surrounding the microdeletion breakpoints revealed either intrinsic repetitivity of the deleted region or short direct repeats adjacent to the breakpoint junctions. This is consistent with these repeats having mediated the microdeletions via replication slippage and supports the view that the mutational spectrum of the GNPTG gene is strongly influenced by the properties of the local DNA sequence environment.
19394258	The first founder DGUOK mutation associated with hepatocerebral mitochondrial DNA depletion syndrome.	Deoxyguanosine kinase (dGK) deficiency is a frequent cause of mitochondrial DNA depletion associated with a hepatocerebral phenotype. In this study, we describe a new splice site mutation in the DGUOK gene and the clinical, radiologic, and genetic features of these DGUOK patients. This new DGUOK homozygous mutation (c.444-62C>A) was identified in three patients from two North-African consanguineous families with combined respiratory chain deficiencies and mitochondrial DNA depletion in the liver. Brain MRIs are normal in DGUOK patients in the literature. Interestingly, we found subtentorial abnormal myelination and moderate hyperintensity in the bilateral pallidi in our patients. This new mutation creates a cryptic splice site in intron 3 (in position -62) and is predicted to result in a larger protein with an in-frame insertion of 20 amino acids. In silico analysis of the putative impact of the insertion shows serious clashes in protein conformation: this insertion disrupts the alpha5 helix of the dGK kinase domain, rendering the protein unable to bind purine deoxyribonucleosides. In addition, a common haplotype that segregated with the disease in both families was detected by haplotype reconstruction with 10 markers (microsatellites and SNPs), which span 4.6 Mb of DNA covering the DGUOK locus. In conclusion, we report a new DGUOK splice site mutation that provide insight into a critical protein domain (dGK kinase domain) and the first founder mutation in a North-African population.
19445921	Cardioprotective effect of salvianolic acid A on isoproterenol-induced myocardial infarction in rats.	The present study was designed to evaluate the cardioprotective potential of salvianolic acid A on isoproterenol-induced myocardial infarction in rats. Hemodynamic parameters and lead II electrocardiograph were monitored and recorded continuously. Cardiac marker enzymes and antioxidative parameters in serum and heart tissues were measured. Assay for mitochondrial respiratory function and histopathological examination of heart tissues were performed. Isoproterenol-treated rats showed significant increases in the levels of lactate dehydrogenase, aspartate transaminase, creatine kinase and malondialdehyde and significant decreases in the activities of superoxide dismutase, catalase and glutathione peroxidase in serum and heart. These rats also showed declines in left ventricular systolic pressure, maximum and minimum rate of developed left ventricular pressure, and elevation of left ventricular end-diastolic pressure and ST-segment. In addition, mitochondrial respiratory dysfunction characterized by decreased respiratory control ratio and ADP/O was observed in isoproterenol-treated rats. Administration of salvianolic acid A for a period of 8 days significantly attenuated isoproterenol-induced cardiac dysfunction and myocardial injury and improved mitochondrial respiratory function. The protective role of salvianolic acid A against isoproterenol-induced myocardial damage was further confirmed by histopathological examination. The results of our study suggest that salvianolic acid A possessing antioxidant activity has a significant protective effect against isoproterenol-induced myocardial infarction.
19463742	Melanocortin-4 receptor activation inhibits c-Jun N-terminal kinase activity and promotes insulin signaling.	The melanocortin system is crucial to regulation of energy homeostasis. The melanocortin receptor type 4 (MC4R) modulates insulin signaling via effects on c-Jun N-terminal kinase (JNK). The melanocortin agonist NDP-MSH dose-dependently inhibited JNK activity in HEK293 cells stably expressing the human MC4R; effects were reversed by melanocortin receptor antagonist. NDP-MSH time- and dose-dependently inhibited IRS-1(ser307) phosphorylation, effects also reversed by a specific melanocortin receptor antagonist. NDP-MSH augmented insulin-stimulated AKT phosphorylation in vitro. The melanocortin agonist melanotan II increased insulin-stimulated AKT phosphorylation in the rat hypothalamus in vivo. NDP-MSH increased insulin-stimulated glucose uptake in hypothalamic GT1-1 cells. The current study shows that the melanocortinergic system interacts with insulin signaling via novel effects on JNK activity.
19484664	Angiotensin converting enzyme gene polymorphism in Turkish asthmatic patients.	Asthma is a chronic inflammatory disease of the airways. Several candidate genes have been identified with a potential role in the pathogenesis of asthma, including the angiotensin converting enzyme (ACE) gene. We aimed to investigate the frequency of an ACE gene polymorphism in Turkish asthmatic patients and to determine its impact on clinical parameters and disease severity. Ninety-seven asthmatic patients (M/F 25/72, mean age 39 +/- 13 years) and 96 healthy subjects (M/F 26/70, mean age 38 +/- 12 years) were included. At baseline, all participants completed a questionnaire on demographics, symptoms, triggering factors, severity of asthma, and the presence of atopism. Blood samples were obtained from all patients and genomic DNA was isolated. The frequency of the ACE genotypes (I = insertion and D = deletion) among asthmatics and controls were compared: asthmatics showed a 40.2% prevalence of the DD genotype (n = 39), ID was 45.4% (n = 44), and II was 14.4% (n = 14.4). In the control subjects, the frequency of DD was 18.8% (n = 18), ID was 50% (n = 48) and II was 31.3% (n = 30). The DD ACE genotype was significantly more frequent in asthmatics compared with controls (p < 0.001). Asthmatics with the ID ACE genotype showed a higher frequency of drug allergies, although this was not statistically significant (p = 0.08). Asthmatics with the DD genotype appeared to have a higher incidence of asthmatic episode exacerbations due to viral infections, but again this was not statistically significant (p = 0.08). Patients with mild or moderate-severe asthma had similar frequencies of these mutations. We found a higher frequency of the ACE DD gene mutation in Turkish asthmatic patients compared with non-asthmatics, suggesting that this ACE gene polymorphism may be a risk factor for asthma but does not increase the severity of the disease.
19508969	Hypomorphic mutations in meckelin (MKS3/TMEM67) cause nephronophthisis with liver fibrosis (NPHP11).	BACKGROUND: Nephronophthisis (NPHP), a rare recessive cystic kidney disease, is the most frequent genetic cause of chronic renal failure in children and young adults. Mutations in nine genes (NPHP1-9) have been identified. NPHP can be associated with retinal degeneration (Senior-Loken syndrome), brainstem and cerebellar anomalies (Joubert syndrome), or liver fibrosis. METHODS: To identify a causative gene for the subset of patients with associated liver fibrosis, the authors performed a genome wide linkage search in a consanguineous family with three affected patients using 50K SNP microarrays and homozygosity mapping. RESULTS: The authors obtained a significant maximum parametric LOD (logarithm of odds) score of Z(max) = 3.72 on chromosome 8q22 and identified a homozygous missense mutation in the gene MKS3/TMEM67. When examining a worldwide cohort of 62 independent patients with NPHP and associated liver fibrosis we identified altogether four novel mutations (p.W290L, p.C615R, p.G821S, and p.G821R) in five of them. Mutations of MKS3/TMEM67, found recently in Meckel-Gruber syndrome (MKS) type 3 and Joubert syndrome (JBTS) type 6, are predominantly truncating mutations. In contrast, the mutations detected here in patients with NPHP and associated liver fibrosis are exclusively missense mutations. This suggests that they may represent hypomorphic alleles, leading to a milder phenotype compared with the more severe MKS or JBTS phenotype. Additionally, mutation analysis for MKS3/TMEM67 in 120 patients with JBTS yielded seven different (four novel) mutations in five patients, four of whom also presented with congenital liver fibrosis. CONCLUSIONS: Hypomorphic MKS3/TMEM67 mutations cause NPHP with liver fibrosis (NPHP11). This is the first report of MKS3 mutations in patients with no vermian agenesis and without neurological signs. Thus NPHP, JBTS, and MKS represent allelic disorders.
19536134	TAK1 is an essential regulator of BMP signalling in cartilage.	TGFbeta activated kinase 1 (TAK1), a member of the MAPKKK family, controls diverse functions ranging from innate and adaptive immune system activation to vascular development and apoptosis. To analyse the in vivo function of TAK1 in cartilage, we generated mice with a conditional deletion of Tak1 driven by the collagen 2 promoter. Tak1(col2) mice displayed severe chondrodysplasia with runting, impaired formation of secondary centres of ossification, and joint abnormalities including elbow dislocation and tarsal fusion. This phenotype resembled that of bone morphogenetic protein receptor (BMPR)1 and Gdf5-deficient mice. BMPR signalling was markedly impaired in TAK1-deficient chondrocytes as evidenced by reduced expression of known BMP target genes as well as reduced phosphorylation of Smad1/5/8 and p38/Jnk/Erk MAP kinases. TAK1 mediates Smad1 phosphorylation at C-terminal serine residues. These findings provide the first in vivo evidence in a mammalian system that TAK1 is required for BMP signalling and functions as an upstream activating kinase for Smad1/5/8 in addition to its known role in regulating MAP kinase pathways. Our experiments reveal an essential role for TAK1 in the morphogenesis, growth, and maintenance of cartilage.
19549709	Efficacy of everolimus (RAD001) in patients with advanced NSCLC previously treated with chemotherapy alone or with chemotherapy and EGFR inhibitors.	BACKGROUND: Treatment options are scarce in pretreated advanced non-small-cell lung cancer (NSCLC) patients. RAD001, an oral inhibitor of the mammalian target of rapamycin (mTOR), has shown phase I efficacy in NSCLC. METHODS: Stage IIIb or IV NSCLC patients, with two or fewer prior chemotherapy regimens, one platinum based (stratum 1) or both chemotherapy and epidermal growth factor receptor tyrosine kinase inhibitors (stratum 2), received RAD001 10 mg/day until progression or unacceptable toxicity. Primary objective was overall response rate (ORR). Analyses of markers associated with the mTOR pathway were carried out on archival tumor from a subgroup using immunohistochemistry (IHC) and direct mutation sequencing. RESULTS: Eighty-five patients were enrolled, 42 in stratum 1 and 43 in stratum. ORR was 4.7% (7.1% stratum 1; 2.3% stratum 2). Overall disease control rate was 47.1%. Median progression-free survivals (PFSs) were 2.6 (stratum 1) and 2.7 months (stratum 2). Common > or =grade 3 events were fatigue, dyspnea, stomatitis, anemia, and thrombocytopenia. Pneumonitis, probably or possibly related, mainly grade 1/2, occurred in 25%. Cox regression analysis of IHC scores found that only phospho AKT (pAKT) was a significant independent predictor of worse PFS. CONCLUSIONS: RAD001 10 mg/day was well tolerated, showing modest clinical activity in pretreated NSCLC. Evaluation of RAD001 plus standard therapy for metastatic NSCLC continues.
19565319	Adenosine A(2A) receptor gene (ADORA2A) variants may increase autistic symptoms and anxiety in autism spectrum disorder.	Autism spectrum disorders (ASDs) are heterogeneous disorders presenting with increased rates of anxiety. The adenosine A(2A) receptor gene (ADORA2A) is associated with panic disorder and is located on chromosome 22q11.23. Its gene product, the adenosine A(2A) receptor, is strongly expressed in the caudate nucleus, which also is involved in ASD. As autistic symptoms are increased in individuals with 22q11.2 deletion syndrome, and large 22q11.2 deletions and duplications have been observed in ASD individuals, in this study, 98 individuals with ASD and 234 control individuals were genotyped for eight single-nucleotide polymorphisms in ADORA2A. Nominal association with the disorder was observed for rs2236624-CC, and phenotypic variability in ASD symptoms was influenced by rs3761422, rs5751876 and rs35320474. In addition, association of ADORA2A variants with anxiety was replicated for individuals with ASD. Findings point toward a possible mediating role of ADORA2A variants on phenotypic expression in ASD that need to be replicated in a larger sample.
19624920	Clusters of multidrug-resistant Mycobacterium tuberculosis cases, Europe.	Molecular surveillance of multidrug-resistant tuberculosis (MDR TB) was implemented in Europe as case reporting in 2005. For all new MDR TB cases detected from January 2003 through June 2007, countries reported case-based epidemiologic data and DNA fingerprint patterns of MDR TB strains when available. International clusters were detected and analyzed. From 2003 through mid-2007 in Europe, 2,494 cases of MDR TB were reported from 24 European countries. Epidemiologic and molecular data were linked for 593 (39%) cases, and 672 insertion sequence 6110 DNA fingerprint patterns were reported from 19 countries. Of these patterns, 288 (43%) belonged to 18 European clusters; 7 clusters (242/288 cases, 84%) were characterized by strains of the Beijing genotype family, including the largest cluster (175/288 cases, 61%). Both clustering and the Beijing genotype were associated with strains originating in eastern European countries. Molecular cluster detection contributes to identification of transmission profile, risk factors, and control measures.
19631624	Learning and memory deficits in ecstasy users and their neural correlates during a face-learning task.	It has been consistently shown that ecstasy users display impairments in learning and memory performance. In addition, working memory processing in ecstasy users has been shown to be associated with neural alterations in hippocampal and/or cortical regions as measured by functional magnetic resonance imaging (fMRI). Using functional imaging and a face-learning task, we investigated neural correlates of encoding and recalling face-name associations in 20 recreational drug users whose predominant drug use was ecstasy and 20 controls. To address the potential confounding effects of the cannabis use of the ecstasy using group, a second analysis included 14 previously tested cannabis users (Nestor, L., Roberts, G., Garavan, H., Hester, R., 2008. Deficits in learning and memory: parahippocampal hyperactivity and frontocortical hypoactivity in cannabis users. Neuroimage 40, 1328-1339). Ecstasy users performed significantly worse in learning and memory compared to controls and cannabis users. A conjunction analysis of the encode and recall phases of the task revealed ecstasy-specific hyperactivity in bilateral frontal regions, left temporal, right parietal, bilateral temporal, and bilateral occipital brain regions. Ecstasy-specific hypoactivity was evident in the right dorsal anterior cingulated cortex (ACC) and left posterior cingulated cortex. In both ecstasy and cannabis groups brain activation was decreased in the right medial frontal gyrus, left parahippocampal gyrus, left dorsal cingulate gyrus, and left caudate. These results elucidated ecstasy-related deficits, only some of which might be attributed to cannabis use. These ecstasy-specific effects may be related to the vulnerability of isocortical and allocortical regions to the neurotoxic effects of ecstasy.
19672862	Protein kinase C alpha-dependent signaling mediates endometrial cancer cell growth and tumorigenesis.	Endometrial cancer is the most common invasive gynecologic malignancy, yet molecular mechanisms and signaling pathways underlying its etiology and pathophysiology remain poorly characterized. We sought to define a functional role for the protein kinase C (PKC) isoform, PKCalpha, in an established cell model of endometrial adenocarcinoma. Ishikawa cells depleted of PKCalpha protein grew slower, formed fewer colonies in anchorage-independent growth assays and exhibited impaired xenograft tumor formation in nude mice. Consistent with impaired growth, PKCalpha knockdown increased levels of the cyclin-dependent kinase (CDK) inhibitors p21(Cip1/WAF1) (p21) and p27(Kip1) (p27). Despite the absence of functional phosphatase and tensin homolog (PTEN) protein in Ishikawa cells, PKCalpha knockdown reduced Akt phosphorylation at serine 473 and concomitantly inhibited phosphorylation of the Akt target, glycogen synthase kinase-3beta (GSK-3beta). PKCalpha knockdown also resulted in decreased basal ERK phosphorylation and attenuated ERK activation following EGF stimulation. p21 and p27 expression was not increased by treatment of Ishikawa cells with ERK and Akt inhibitors, suggesting that PKCalpha regulates CDK expression independently of Akt and ERK. Immunohistochemical analysis of Grade 1 endometrioid adenocarcinoma revealed aberrant PKCalpha expression, with foci of elevated PKCalpha staining, not observed in normal endometrium. These studies demonstrate a critical role for PKCalpha signaling in endometrial tumorigenesis by regulating expression of CDK inhibitors p21 and p27 and activation of Akt and ERK-dependent proliferative pathways. Thus, targeting PKCalpha may provide novel therapeutic options in endometrial tumors.
19681452	Bilateral haemorrhagic infarction of the globus pallidus after cocaine and alcohol intoxication.	Cocaine is a risk factor for both ischemic and haemorrhagic stroke. We present the case of a 31-year-old man with bilateral ischemia of the globus pallidus after excessive alcohol and intranasal cocaine use. Drug-related globus pallidus infarctions are most often associated with heroin. Bilateral basal ganglia infarcts after the use of cocaine, without concurrent heroin use, have never been reported. In our patient, transient cardiac arrhythmia or respiratory dysfunction related to cocaine and/or ethanol use were the most likely causes of cerebral hypoperfusion.
19707748	Seizures associated with levofloxacin: case presentation and literature review.	PURPOSE: We present a case of a patient who developed seizures shortly after initiating treatment with levofloxacin and to discuss the potential drug-drug interactions related to the inhibition of cytochrome P450 (CYP) 1A2 in this case, as well as in other cases, of levofloxacin-induced seizures. METHODS: Several biomedical databases were searched including MEDLINE, Cochrane and Ovid. The main search terms utilized were case report and levofloxacin. The search was limited to studies published in English. RESULTS: Six cases of levofloxacin-induced seizures have been reported in the literature. Drug-drug interactions related to the inhibition of CYP1A2 by levofloxacin are likely involved in the clinical outcome of these cases. CONCLUSIONS: Clinicians are exhorted to pay close attention when initiating levofloxacin therapy in patients taking medications with epileptogenic properties that are CYP1A2 substrates.
19721134	The antiarrhythmic effect and possible ionic mechanisms of pilocarpine on animal models.	This study was designed to evaluate the effects of pilocarpine and explore the underlying ionic mechanism, using both aconitine-induced rat and ouabain-induced guinea pig arrhythmia models. Confocal microscopy was used to measure intracellular free-calcium concentrations ([Ca(2+)](i)) in isolated myocytes. The current data showed that pilocarpine significantly delayed onset of arrhythmias, decreased the time course of ventricular tachycardia and fibrillation, reduced arrhythmia score, and increased the survival time of arrhythmic rats and guinea pigs. [Ca(2+)](i) overload induced by aconitine or ouabain was reduced in isolated myocytes pretreated with pilocarpine. Moreover, M(3)-muscarinic acetylcholine receptor (mAChR) antagonist 4-DAMP (4-diphenylacetoxy-N-methylpiperidine-methiodide) partially abolished the beneficial effects of pilocarpine. These data suggest that pilocarpine produced antiarrhythmic actions on arrhythmic rat and guinea pig models induced by aconitine or ouabain via stimulating the cardiac M(3)-mAChR. The mechanism may be related to the improvement of Ca(2+) handling.
19759529	The glycine transporter-1 inhibitor SSR103800 displays a selective and specific antipsychotic-like profile in normal and transgenic mice.	Schizophrenia has been initially associated with dysfunction in dopamine neurotransmission. However, the observation that antagonists of the glutamate N-methyl-D-aspartate (NMDA) receptor produce schizophrenic-like symptoms in humans has led to the idea of a dysfunctioning of the glutamatergic system via its NMDA receptor. As a result, there is a growing interest in the development of pharmacological agents with potential antipsychotic properties that enhance the activity of the glutamatergic system via a modulation of the NMDA receptor. Among them are glycine transporter-1 (GlyT1) inhibitors such as SSR103800, which indirectly enhance NMDA receptor function by increasing the glycine (a co-agonist for the NMDA receptor) levels in the synapse. This study aimed at investigating the potential antipsychotic-like properties of SSR103800, with a particular focus on models of hyperactivity, involving either drug challenge (ie, amphetamine and MK-801) or transgenic mice (ie, NMDA Nr1(neo-/-) and DAT(-/-)). Results showed that SSR103800 (10-30 mg/kg p.o.) blocked hyperactivity induced by the non-competitive NMDA receptor antagonist, MK-801 and partially reversed spontaneous hyperactivity of NMDA Nr1(neo-/-) mice. In contrast, SSR103800 failed to affect hyperactivity induced by amphetamine or naturally observed in dopamine transporter (DAT(-/-)) knockout mice (10-30 mg/kg p.o.). Importantly, both classical (haloperidol) and atypical (olanzapine, clozapine and aripiprazole) antipsychotics were effective in all these models of hyperactivity. However, unlike these latter, SSR103800 did not produce catalepsy (retention on the bar test) up to 30 mg/kg p.o. Together these findings show that the GlyT1 inhibitor, SSR103800, produces antipsychotic-like effects, which differ from those observed with compounds primarily targeting the dopaminergic system, and has a reduced side-effect potential as compared with these latter drugs.
19779499	Novel CACNA1S mutation causes autosomal dominant hypokalemic periodic paralysis in a South American family.	Hypokalaemic periodic paralysis (HypoPP) is an autosomal dominant disorder, which is characterized by periodic attacks of muscle weakness associated with a decrease in the serum potassium level. A major disease-causing gene for HypoPP has been identified as CACNA1S, which encodes the skeletal muscle calcium channel alpha-subunit with four transmembrane domains (I-IV), each with six transmembrane segments (S1-S6). To date, all CACNA1S mutations identified in HypoPP patients are located within the voltage-sensor S4 segment. In this study we report a novel CACNA1S mutation in a new region of the protein, the S3 segment of domain III. We characterized a four-generation South American family with HypoPP. Genetic analysis identified a novel V876E mutation in all HypoPP patients in the family, but not in normal family members or 160 control people. Clinical analysis indicates that mutation V876E is associated with a severe outcome as characterized by a very early age of onset, complete penetrance and a severe prognosis including death. These results identify a new mutation in CACNA1S and expand the spectrum of CACNA1S mutations associated with HypoPP.
