abstract_id	title	abstract
1353340	Late-onset metachromatic leukodystrophy: molecular pathology in two siblings.	We report on a new allele at the arylsulfatase A (ARSA) locus causing late-onset metachromatic leukodystrophy (MLD). In that allele arginine84, a residue that is highly conserved in the arylsulfatase gene family, is replaced by glutamine. In contrast to alleles that cause early-onset MLD, the arginine84 to glutamine substitution is associated with some residual ARSA activity. A comparison of genotypes, ARSA activities, and clinical data on 4 individuals carrying the allele of 81 patients with MLD examined, further validates the concept that different degrees of residual ARSA activity are the basis of phenotypical variation in MLD.. 
1671881	Two distinct mutations at a single BamHI site in phenylketonuria.	Classical phenylketonuria is an autosomal recessive disease caused by a deficiency of hepatic phenylalanine hydroxylase (PAH). The abolition of an invariant BamHI site located in the coding sequence of the PAH gene (exon 7) led to the recognition of two new point mutations at codon 272 and 273 (272gly----stop and 273ser----phe, respectively). Both mutations were detected in north eastern France or Belgium and occurred on the background of RFLP haplotype 7 alleles. The present study supports the view that the clinical heterogeneity in PKU is accounted for by the large variety of mutant genotypes associated with PAH deficiencies.. 
1848636	Debrisoquine phenotype and the pharmacokinetics and beta-2 receptor pharmacodynamics of metoprolol and its enantiomers.	The metabolism of the cardioselective beta-blocker metoprolol is under genetic control of the debrisoquine/sparteine type. The two metabolic phenotypes, extensive (EM) and poor metabolizers (PM), show different stereoselective metabolism, resulting in apparently higher beta-1 adrenoceptor antagonistic potency of racemic metoprolol in EMs. We investigated if the latter also applies to the beta-2 adrenoceptor antagonism by metoprolol. The drug effect studied was the antagonism by metoprolol of terbutaline-induced hypokalemia. By using pharmacokinetic pharmacodynamic modeling the pharmacodynamics of racemic metoprolol and the active S-isomer, were quantitated in EMs and PMs in terms of IC50 values, representing metoprolol plasma concentrations resulting in half-maximum receptor occupancy. Six EMs received 0.5 mg of terbutaline s.c. on two different occasions: 1) 1 hr after administration of a placebo and 2) 1 hr after 150 mg of metoprolol p.o. Five PMs were studied according to the same protocol, except for a higher terbutaline dose (0.75 mg) on day 2. Blood samples for the analysis of plasma potassium, terbutaline, metoprolol (racemic, R- and S-isomer), and alpha-hydroxymetoprolol concentrations were taken at regular time intervals, during 8 hr after metoprolol. In PMs, metoprolol increased the terbutaline area under the plasma concentration vs. time curve (+67%). Higher metoprolol/alpha-hydroxymetoprolol ratios in PMs were predictive for higher R-/S-isomer ratios of unchanged drug. There was a difference in metoprolol potency with higher racemic metoprolol IC50 values in PMs (72 +/- 7 ng.ml-1) than EMs (42 +/- 8 ng.ml-1, P less than .001).(ABSTRACT TRUNCATED AT 250 WORDS)
2422478	Midline B3 serotonin nerves in rat medulla are involved in hypotensive effect of methyldopa.	Previous experiments in this laboratory have shown that microinjection of methyldopa onto the ventrolateral cells of the B3 serotonin neurons in the medulla elicits a hypotensive response mediated by a projection descending into the spinal cord. The present experiments were designed to investigate the role of the midline cells of the B3 serotonin neurons in the medulla, coinciding with the raphe magnus. In spontaneously hypertensive, stroke-prone rats, microinjection of methyldopa into the area of the midline B3 serotonin cell group in the ventral medulla caused a potent hypotension of 30-40 mm Hg, which was maximal 2-3 h after administration and was abolished by the serotonin neurotoxin 5,7-dihydroxytryptamine (5,7-DHT) injected intracerebroventricularly. However, intraspinal injection of 5,7-DHT to produce a more selective lesion of only descending serotonin projections in the spinal cord did not affect this hypotension. Further, 5,7-DHT lesion of serotonin nerves travelling in the median forebrain bundle, one of the main ascending pathways from the B3 serotonin cells, did not affect the fall in blood pressure associated with a midline B3 serotonin methyldopa injection. It is concluded therefore that, unlike the ventrolateral B3 cells which mediate a methyldopa-induced hypotension via descending projections, the midline serotonin B3 cells in the medulla contribute to the hypotensive action of methyldopa, either by way of an ascending projection which does not pass through the median forebrain bundle, or through a projection restricted to the caudal brainstem.
2491010	Molecular and phenotypic analysis of patients with deletions within the deletion-rich region of the Duchenne muscular dystrophy (DMD) gene.	Eighty unrelated individuals with Duchenne muscular dystrophy (DMD)or Becker muscular dystrophy (BMD) were found to have deletions in the major deletion-rich region of the DMD locus. This region includes the last five exons detected by cDNA5b-7, all exons detected by cDNA8, and the first two exons detected by cDNA9. These 80 individuals account for approximately 75% of 109 deletions of the gene, detected among 181 patients analyzed with the entire dystrophin cDNA. Endpoints for many of these deletions were further characterized using two genomic probes, p20 (DXS269; Wapenaar et al.) and GMGX11 (DXS239; present paper). Clinical findings are presented for all 80 patients allowing a correlation of phenotypic severity with the genotype. Thirty-eight independent patients were old enough to be classified as DMD, BMD, or intermediate phenotype and had deletions of exons with sequenced intron/exon boundaries. Of these, eight BMD patients and one intermediate patient had gene deletions predicted to leave the reading frame intact, while 21 DMD patients, 7 intermediate patients, and 1 BMD patient had gene deletions predicted to disrupt the reading frame. Thus, with two exceptions, frameshift deletions of the gene resulted in more severe phenotype than did in-frame deletions. This is in agreement with recent findings by Baumbach et al. and Koenig et al. but is in contrast to findings, by Malhotra et al. at the 5 ' end of the gene.
7468724	Cardiovascular complications associated with terbutaline treatment for preterm labor.	Severe cardiovascular complications occurred in eight of 160 patients treated with terbutaline for preterm labor. Associated corticosteroid therapy and twin gestations appear to be predisposing factors. Potential mechanisms of the pathophysiology are briefly discussed.
7668252	Cloning of human very-long-chain acyl-coenzyme A dehydrogenase and molecular characterization of its deficiency in two patients.	Two overlapping cDNA clones (1, 991 bp and 736 bp, respectively) encoding the precursor of human mitochondrial very-long-chain acyl-coenzyme A dehydrogenase (VLCAD) were cloned and sequenced. The cDNA inserts of these clones together encompass a region of 2, 177 bases, encoding the entire protein of 655 amino acids, including a 40-amino acid leader peptide and a 615-amino acid mature polypeptide. PCR-amplified VLCAD cDNAs were sequenced in cultured fibroblasts from two VLCAD-deficient patients. In both patients, a 105-bp deletion encompassing bases 1078-1182 in VLCAD cDNA was identified. The deletion seems to occur due to exon skipping during processing of VLCAD pre-mRNA. This is the first demonstration of a mutation causing VLCAD deficiency. Quantitative cDNA expression of normal human VLCAD was performed in the patients fibroblasts, using vaccinia viral system, which demonstrated that the deficiency of the normal VLCAD protein causes impaired long-chain fatty acid beta-oxidation activity in the patients fibroblasts. In patient fibroblasts, raising VLCAD activity to approximately 20% of normal control fibroblast activity raised palmitic acid beta-oxidation flux to the level found in control fibroblasts, which may offer important information for the rational design of future somatic gene therapy for VLCAD deficiency.. 
7905839	Human mu opiate receptor. cDNA and genomic clones, pharmacologic characterization and chromosomal assignment.	A human mu opiate receptor cDNA has been identified from a cerebral cortical cDNA library using sequences from the rat mu opiate receptor cDNA. The human mu opiate receptor (h mu OR1) shares 95% amino acid identity with the rat sequence. The expressed mu OR1 recognized tested opiate drugs and opioid peptides in a sodium- and GTP-sensitive fashion with affinities virtually identical to those displayed by the rat mu opiate receptor. Effects on cyclic AMP are similar to those noted for the rat mu opiate receptor. An 18 kb genomic clone hybridizing with the h mu OR1 cDNA contains 63 and 489 bp exonic sequences flanked by splice donor/acceptor sequences. Analysis of hybridization to DNA prepared from human rodent hybrid cell lines and chromosomal in situ hybridization studies indicate localization to 6q24-25. An MspI polymorphism, producing a 3.7 kb band, may prove useful in assessing this gene's involvement in neuropsychiatric disorders involving opiatergic systems.
8755918	Mutations associated with variant phenotypes in ataxia-telangiectasia.	We have identified 14 families with ataxia-telangiectasia (A-T) in which mutation of the ATM gene is associated with a less severe clinical and cellular phenotype (approximately 10% -15% of A-T families identified in the United Kingdom). In 10 of these families, all the homozygotes have a 137-bp insertion in their cDNA caused by a point mutation in a sequence resembling a splice-donor site. The second A-T allele has a different mutation in each patient. We show that the less severe phenotype in these patients is caused by some degree of normal splicing, which occurs as an alternative product from the insertion-containing allele. The level of the 137-bp PCR product containing the insertion was lowest in two patients who showed a later onset of cerebellar ataxia. A further four families who do not have this insertion have been identified. Mutations detected in two of four of these are missense mutations, normally rare in A-T patients. The demonstration of mutations giving rise to a slightly milder phenotype in A-T raises the interesting question of what range of phenotypes might occur in individuals in whom both mutations are milder. One possibility might be that individuals who are compound heterozygotes for ATM mutations are more common than we realize.. 
8829135	Nefiracetam (DM-9384) reverses apomorphine-induced amnesia of a passive avoidance response: delayed emergence of the memory retention effects.	Nefiracetam is a novel pyrrolidone derivative which attenuates scopolamine-induced learning and post-training consolidation deficits. Given that apomorphine inhibits passive avoidance retention when given during training or in a defined 10-12h post-training period, we evaluated the ability of nefiracetam to attenuate amnesia induced by dopaminergic agonism. A step-down passive avoidance paradigm was employed and nefiracetam (3 mg/kg) and apomorphine (0.5 mg/kg) were given alone or in combination during training and at the 10-12h post-training period of consolidation. Co-administration of nefiracetam and apomorphine during training or 10h thereafter produced no significant anti-amnesic effect. However, administration of nefiracetam during training completely reversed the amnesia induced by apomorphine at the 10h post-training time and the converse was also true. These effects were not mediated by a dopaminergic mechanism as nefiracetam, at millimolar concentrations, failed to displace either [3H]SCH 23390 or [3H]spiperone binding from D1 or D2 dopamine receptor subtypes, respectively. It is suggested that nefiracetam augments molecular processes in the early stages of events which ultimately lead to consolidation of memory.
9294109	Myotonic dystrophy protein kinase is involved in the modulation of the Ca2+ homeostasis in skeletal muscle cells.	Myotonic dystrophy (DM), the most prevalent muscular disorder in adults, is caused by (CTG) n-repeat expansion in a gene encoding a protein kinase (DM protein kinase; DMPK) and involves changes in cytoarchitecture and ion homeostasis. To obtain clues to the normal biological role of DMPK in cellular ion homeostasis, we have compared the resting [Ca2 +] i, the amplitude and shape of depolarization-induced Ca2 + transients, and the content of ATP-driven ion pumps in cultured skeletal muscle cells of wild-type and DMPK [-/-] knockout mice. In vitro-differentiated DMPK [-/-] myotubes exhibit a higher resting [Ca2 +] i than do wild-type myotubes because of an altered open probability of voltage-dependent l-type Ca2 + and Na + channels. The mutant myotubes exhibit smaller and slower Ca2 + responses upon triggering by acetylcholine or high external K +. In addition, we observed that these Ca2 + transients partially result from an influx of extracellular Ca2 + through the l-type Ca2 + channel. Neither the content nor the activity of Na +/K + ATPase and sarcoplasmic reticulum Ca2 + -ATPase are affected by DMPK absence. In conclusion, our data suggest that DMPK is involved in modulating the initial events of excitation-contraction coupling in skeletal muscle.. 
9647766	cDNA sequence and chromosomal localization of the remaining three human nuclear encoded iron sulphur protein (IP) subunits of complex I: the human IP fraction is completed.	NADH:ubiquinone oxidoreductase (complex I) of the mitochondrial respiratory chain can be fragmented in a flavoprotein (FP), iron-sulfur protein (IP), and hydrophobic protein (HP) subfraction. The IP subfraction is hypothesized to be significant, since it contains important prosthetic groups highly conserved among species. We cloned the cDNA of three remaining human NADH:ubiquinone oxidoreductase subunits of this IP fraction: the NDUFS2 (49 kDa), NDUFS3 (30 kDa), and NDUFS6 (13 kDa) subunits. All presented cDNAs include the complete open reading frame (ORF), which consist of 1392, 795, and 375 base pairs, coding for 463, 264, and 124 amino acids, respectively. The latter show 96, 90, and 83% homology with the corresponding bovine translation products. The 3' untranslated regions (UTR) are complete in all three cDNAs. Polymerase chain reaction performed with DNA isolated from somatic human-rodent cell hybrids containing defined human chromosomes as template gave a human-specific signal which mapped the NDUFS2 and NDUFS3 subunits to chromosomes 1 and 11, respectively. In the case of the NDUFS6 subunit a pseudogene may be present since signals were seen in the lanes containing chromosomes 5 and 6. The NDUFS2 contains a highly conserved protein kinase C phosphorylation site and the NDUFS3 subunit contains a highly conserved casein kinase II phosphorylation site which make them strong candidates for future mutation detection studies in enzymatic complex I-deficient patients.
9672936	Pethidine-associated seizure in a healthy adolescent receiving pethidine for postoperative pain control.	A healthy 17-year-old male received standard intermittent doses of pethidine via a patient-controlled analgesia (PCA) pump for management of postoperative pain control. Twenty-three h postoperatively he developed a brief self-limited seizure. Both plasma pethidine and norpethidine were elevated in the range associated with clinical manifestations of central nervous system excitation. No other risk factors for CNS toxicity were identified. This method allowed frequent self-dosing of pethidine at short time intervals and rapid accumulation of pethidine and norpethidine. The routine use of pethidine via PCA even for a brief postoperative analgesia should be reconsidered.
9746003	Inappropriate use of carbamazepine and vigabatrin in typical absence seizures.	Carbamazepine and vigabatrin are contraindicated in typical absence seizures. Of 18 consecutive referrals of children with resistant typical absences only, eight were erroneously treated with carbamazepine either as monotherapy or as an add-on. Vigabatrin was also used in the treatment of two children. Frequency of absences increased in four children treated with carbamazepine and two of these developed myoclonic jerks, which resolved on withdrawal of carbamazepine. Absences were aggravated in both cases where vigabatrin was added on to concurrent treatment. Optimal control of the absences was achieved with sodium valproate, lamotrigine, or ethosuximide alone or in combination.
10491763	Hepatocyte nuclear factor-6: associations between genetic variability and type II diabetes and between genetic variability and estimates of insulin secretion.	The transcription factor hepatocyte nuclear factor (HNF)-6 is an upstream regulator of several genes involved in the pathogenesis of maturity-onset diabetes of the young. We therefore tested the hypothesis that variability in the HNF-6 gene is associated with subsets of Type II (non-insulin-dependent) diabetes mellitus and estimates of insulin secretion in glucose tolerant subjects.   We cloned the coding region as well as the intron-exon boundaries of the HNF-6 gene. We then examined them on genomic DNA in six MODY probands without mutations in the MODY1, MODY3 and MODY4 genes and in 54 patients with late-onset Type II diabetes by combined single strand conformational polymorphism-heteroduplex analysis followed by direct sequencing of identified variants. An identified missense variant was examined in association studies and genotype-phenotype studies.   We identified two silent and one missense (Pro75 Ala) variant. In an association study the allelic frequency of the Pro75Ala polymorphism was 3.2% (95% confidence interval, 1.9-4.5) in 330 patients with Type II diabetes mellitus compared with 4.2% (2.4-6.0) in 238 age-matched glucose tolerant control subjects. Moreover, in studies of 238 middle-aged glucose tolerant subjects, of 226 glucose tolerant offspring of Type II diabetic patients and of 367 young healthy subjects, the carriers of the polymorphism did not differ from non-carriers in glucose induced serum insulin or C-peptide responses.   Mutations in the coding region of the HNF-6 gene are not associated with Type II diabetes or with changes in insulin responses to glucose among the Caucasians examined.
10661407	Langerin, a novel C-type lectin specific to Langerhans cells, is an endocytic receptor that induces the formation of Birbeck granules.	We have identified a type II Ca2+-dependent lectin displaying mannose-binding specificity, exclusively expressed by Langerhans cells (LC), and named Langerin. LC are uniquely characterized by Birbeck granules (BG), which are organelles consisting of superimposed and zippered membranes. Here, we have shown that Langerin is constitutively associated with BG and that antibody to Langerin is internalized into these structures. Remarkably, transfection of Langerin cDNA into fibroblasts created a compact network of membrane structures with typical features of BG. Langerin is thus a potent inducer of membrane superimposition and zippering leading to BG formation. Our data suggest that induction of BG is a consequence of the antigen-capture function of Langerin, allowing routing into these organelles and providing access to a nonclassical antigen-processing pathway.
10788334	Founder mutations in the BRCA1 gene in Polish families with breast-ovarian cancer.	We have undertaken a hospital-based study, to identify possible BRCA1 and BRCA2 founder mutations in the Polish population. The study group consisted of 66 Polish families with cancer who have at least three related females affected with breast or ovarian cancer and who had cancer diagnosed, in at least one of the three affected females, at age < 50 years. A total of 26 families had both breast and ovarian cancers, 4 families had ovarian cancers only, and 36 families had breast cancers only. Genomic DNA was prepared from the peripheral blood leukocytes of at least one affected woman from each family. The entire coding region of BRCA1 and BRCA2 was screened for the presence of germline mutations, by use of SSCP followed by direct sequencing of observed variants. Mutations were found in 35 (53%) of the 66 families studied. All but one of the mutations were detected within the BRCA1 gene. BRCA1 abnormalities were identified in all four families with ovarian cancer only, in 67% of 27 families with both breast and ovarian cancer, and in 34% of 35 families with breast cancer only. The single family with a BRCA2 mutation had the breast-ovarian cancer syndrome. Seven distinct mutations were identified; five of these occurred in two or more families. In total, recurrent mutations were found in 33 (94%) of the 35 families with detected mutations. Three BRCA1 abnormalities - 5382insC, C61G, and 4153delA - accounted for 51%, 20%, and 11% of the identified mutations, respectively.. 
11009181	Apomorphine: an underutilized therapy for Parkinson's disease.	Apomorphine was the first dopaminergic drug ever used to treat symptoms of Parkinson's disease. While powerful antiparkinsonian effects had been observed as early as 1951, the potential of treating fluctuating Parkinson's disease by subcutaneous administration of apomorphine has only recently become the subject of systematic study. A number of small scale clinical trials have unequivocally shown that intermittent subcutaneous apomorphine injections produce antiparkinsonian benefit close if not identical to that seen with levodopa and that apomorphine rescue injections can reliably revert off-periods even in patients with complex on-off motor swings. Continuous subcutaneous apomorphine infusions can reduce daily off-time by more than 50% in this group of patients, which appears to be a stronger effect than that generally seen with add-on therapy with oral dopamine agonists or COMT inhibitors. Extended follow-up studies of up to 8 years have demonstrated long-term persistence of apomorphine efficacy. In addition, there is convincing clinical evidence that monotherapy with continuous subcutaneous apomorphine infusions is associated with marked reductions of preexisting levodopa-induced dyskinesias. The main side effects of subcutaneous apomorphine treatment are related to cutaneous tolerability problems, whereas sedation and psychiatric complications play a lesser role. Given the marked degree of efficacy of subcutaneous apomorphine treatment in fluctuating Parkinson's disease, this approach seems to deserve more widespread clinical use.
11054569	Rab6c, a new member of the rab gene family, is involved in drug resistance in MCF7/AdrR cells.	A new Rab6 homolog cDNA, Rab6c, was discovered by a hypermethylated DNA fragment probe that was isolated from a human multidrug resistant (MDR) breast cancer cell line, MCF7/AdrR, by the methylation sensitive-representational difference analysis (MS-RDA) technique. Rab6c was found to be under-expressed in MCF7/AdrR and MES-SA/Dx5 (a human MDR uterine sarcoma cell line) compared with their non-MDR parental cell lines. MCF7/AdrR cells expressing the exogenous Rab6c exhibited less resistance to several anti-cancer drugs, such as doxorubicin (DOX), taxol, vinblastine, and vincristine, than the control cells containing the empty vector. Flow cytometry experiments confirmed that the transfectants' diminished resistance to DOX was caused by increased drug accumulation induced by the exogenous Rab6c. These results indicate that Rab6c is involved in drug resistance in MCF7/AdrR cells.
